Job_ID,title,company,location,Mode,Min Salary,Max Salary,Avg Salary,Yr/Hr,Type,Level,Industry,Job Description
3691111778,Sales Representative,Cardinal Health,San Francisco County,On-site,"67,800","70,000",68900,Yearly,Full-time,Entry level,Hospitals and Health Care,"
Location Ideal candidate will reside in greater Los Angeles metro area

Job Description

The Sales Representative role is a position within Cardinal Health’s Acute Care Sales organization The territory sales representative is responsible for meeting and exceeding sales goals by advancing the Nursing Care product portfolio by utilizing solution-based concept selling skills to the Acute Hospital marketplace within the geography of their assigned territory

Responsibilities

The Nursing Care products portfolio is composed of numerous clinical and commoditized medical products utilized for patient care and clinician protection This will be a hybrid role where the majority of supporting and closing of sales will be onsite at the acute hospital though some commoditized products can be supported and sold via remote technologies

Drive sales to achieve sales quota across Nursing Care product categories within assigned geography
Collaborate with supply chain sales representatives and strategic accounts team to drive incremental revenue and achieve sales targets within the context of overall account strategy
Identify qualify prepare and execute effective sales strategies that maintain the existing base of business and support the close of competitive and revenue growth opportunities
Build consultative relationships with clinicians end users and supply chain while maintaining positive working relationships with Channel/Distribution and GPO partners
Present proposals negotiate pricing and effectively differentiate Cardinal Health’s Nursing Care product offerings
Complete in-servicing including demonstrating product applications functionality and use –often on night and weekend shifts to meet customer needs
Assist customers with backorders and other related service issues
Effectively utilize and update sales tools to accurately address trends in existing base of business create call strategies and manage territory and strategic business plans
Utilize data to analyze territory and effectively target accounts
Effectively manage sales pipeline via CRM platform
Maintain knowledge of the current industry/competitive landscape including GPO’s healthcare economics reimbursement competitors and competitive products etc
Attend and participate in sales meetings training programs conventions and tradeshows as directed overnight travel required up to 1 week at a time

Qualifications

Bachelors degree in related field or equivalent work experience preferred
2+ years documented sales success in a competitive sophisticated environment complex capital or tangible products including medical/surgical copiers payroll solutions information systems preferred
Previous experience in a sales function preferred B2B or Inside Sales
Proven track record of top sales achievement with experience in multilevel account management
Strong computer acumen and business application
Strong verbal written and interpersonal communication skills
Valid Drivers License
Ability to travel within region up to 50%
Excellence in process management and organizational agility

A Covid-19 vaccination or a legitimate accommodation is required in order to be employed in this position Covid-19 vaccination includes

2 doses of the Moderna or Pfizer vaccine / 1 dose of the Johnson & Johnson vaccine
1 booster dose of the vaccine Johnson & Johnson Moderna or Pfizer

Please Note vaccines may be required for the position subject to federal state and/or customer requirements

Anticipated salary $67800-$70000 + incentive plan eligibility uncapped
Bonus Eligible No 
Benefits Health insurance 401k Contributions Paid Time Off Vacation STD/LTD

Los Angeles Metro Area

Candidates who are back-to-work people with disabilities without a college degree and Veterans are encouraged to apply





Cardinal Health supports an inclusive workplace that values diversity of thought experience and background We celebrate the power of our differences to create better solutions for our customers by ensuring employees can be their authentic selves each day Cardinal Health is an Equal Opportunity/Affirmative Action employer All qualified applicants will receive consideration for employment without regard to race religion color national origin ancestry age physical or mental disability sex sexual orientation gender identity/expression pregnancy veteran status marital status creed status with regard to public assistance genetic status or any other status protected by federal state or local law"
3648885331,"Specialist, Contract Manufacturing",EMERGING BLUE,San Leandro,On-site,"72,000","88,000",80000,Yearly,Full-time,Entry level,Staffing and Recruiting,"
Job Description
Specialist Contract Manufacturing
We are looking for a Contract Manufacturing Specialist that loves diving into the details and creating an environment where our partnerships with outside manufacturers are in sync with our continued double-digit growth! This team member’s constant interaction and vigilance with our key contract manufacturing partners will ensure supply and service levels are maintained and our customers have all the delicious Torani flavor they want!
We’re searching for someone whose natural hands-on approach will earn credibility with our contract manufacturing partners as well as key internal stakeholders in our Planning Quality and Procurement teams Someone whose effectiveness with our external partners has cultivated Torani’s Contract Manufacturing team’s reputation as a great partner to work with
Do you have what it takes to help us infuse flavor across the world?
SUCCESS FACTORS first 12-18 months

Partnership Caretaker Contract manufacturing partnerships are critically important at Torani You have helped to build lasting relationships fostered by robust two-way communication you’ve supported periodic business reviews and compiled the data for standardized scorecards that enable collaboration and win-win propositions Your style has supported Torani’s core value of ‘caring deeply for people” 
Risk Management Hawk You’ve kept a close eye on the 90-day supply plan and helped to identify where adjustments were needed to mitigate inventory risks Your ongoing work with the Planning team surrounding potential short and long-term supply gaps has resulted in the proactive management of capacity constraints which helped us to avoid production interruptions 
Supply Assessor Using data points you have compiled you’ll identify supply concerns and support the key stakeholders in determining the right course of action You’ll have demonstrated the credibility and analytical capabilities needed to support our contract manufacturers when course correction is necessary
Innovation You’ve worked with cross-functional team members to understand and support innovation efforts Contract manufactured supply will have been secured on time and within spec to meet formula and packaging transitions 
You’ve demonstrated your ability to have fun while doing great work! 

Knoweldge And Skills

Prior experience working with contract manufacturing partners 2+ years
Solid understanding of food manufacturing food safety and procurement best practices that support supplier assessment qualification and ongoing management 
Demonstrated ability to communicate and collaborate cross-functionally including strong interpersonal networking and relationship-building skills

 Salary Range $72000 - $88000"
3706398665,2024 University Graduate - Software Engineer,Adobe,San Jose,On-site,"73,200","1,42,700",107950,Yearly,Full-time,Entry level,Software Development,"
Our Company




Changing the world through digital experiences is what Adobe’s all about We give everyone—from emerging artists to global brands—everything they need to design and deliver exceptional digital experiences! We’re passionate about empowering people to create beautiful and powerful images videos and apps and transform how companies interact with customers across every screen




We’re on a mission to hire the very best and are committed to creating exceptional employee experiences where everyone is respected and has access to equal opportunity We realize that new ideas can come from everywhere in the organization and we know the next big idea could be yours!




The Opportunity




Adobe is seeking talented and passionate Software Engineer across all organizations to help plan design develop and test software systems or applications for software enhancements and new products used in local networked cloud-based or Internet-related computer programs and products




What You’ll Do




Develop high-performance reliable testable and maintainable code 
Participating in all aspects of software development activities including design coding code review testing bug fixing and code/API documentation 
Collaborate with engineers and participate in daily or weekly stand ups and meetings 
Grow with the support of your team and help others on the team grow by providing thoughtful feedback and uplifting those around you 
Work both independently and collaboratively within a fast-paced development team with clear positive and constructive communication 
Additional responsibilities as needed based on specific role or team
What You Need to Succeed




Bachelors or Master’s in Computer Science Computer Engineering Electrical Engineer or equivalent experience required
0-1 + years of experience in relevant experience
Proficient in programming languages such as Python Java C++ etc 
Strong technical background with analytical and problem-solving skills
Strong knowledge in Java or JavaScript and at least one other language like Python C# Ruby PHP 
Familiarity with client-side frameworks and libraries like React Vue Angular jQuery 
Excellent problem solving and debugging skills and direct experience with DevOps in a SaaS environment is a plus 
Customer focused and have real passion for quality and engineering excellence at scale 
Excellent communication and collaboration skills 




If you’re looking to make an impact Adobe’s the place for you Discover what our employees are saying about their career experiences on the Adobe Life blog and explore the meaningful benefits we offer




Adobe is an equal opportunity employer We welcome and encourage diversity in the workplace regardless of race gender sexual orientation gender identity disability or veteran status




Our compensation reflects the cost of labor across several  US geographic markets and we pay differently based on those defined markets The US pay range for this position is $73200 -- $142700 annually Pay within this range varies by work location and may also depend on job-related knowledge skills and experience Your recruiter can share more about the specific salary range for the job location during the hiring process




At Adobe for sales roles starting salaries are expressed as total target compensation TTC = base + commission and short-term incentives are in the form of sales commission plans Non-sales roles starting salaries are expressed as base salary and short-term incentives are in the form of the Annual Incentive Plan AIP




In addition certain roles may be eligible for long-term incentives in the form of a new hire equity award




Adobe is proud to be an Equal Employment Opportunity and affirmative action employer We do not discriminate based on gender race or color ethnicity or national origin age disability religion sexual orientation gender identity or expression veteran status or any other applicable characteristics protected by law Learn more




Adobe aims to make Adobecom accessible to any and all users If you have a disability or special need that requires accommodation to navigate our website or complete the application process email accommodations@adobecom or call 408 536-3015




Adobe values a free and open marketplace for all employees and has policies in place to ensure that we do not enter into illegal agreements with other companies to not recruit or hire each other’s employees"
3657017124,Service Engineer,Supermicro,San Jose,On-site,"75,000","1,11,000",93000,Yearly,Full-time,Entry level,Computer Hardware Manufacturing,"
Job Req ID 22526




About Supermicro




Supermicro® is a Top Tier provider of advanced server storage and networking solutions for Data Center Cloud Computing Enterprise IT Hadoop/ Big Data Hyperscale HPC and IoT/Embedded customers worldwide We are the #5 fastest growing company among the Silicon Valley Top 50 technology firms Our unprecedented global expansion has provided us with the opportunity to offer a large number of new positions to the technology community We seek talented passionate and committed engineers technologists and business leaders to join us




Job Summary




Support Supermicro Global Service network and help build a world class service organization This position requires the ability to work flexible hours including nights and weekends as required to work in a data center and call center work environment to provide technical solutions and support over phone and in person and/or web to customers on hardware and software challenges




Essential Duties And Responsibilities




Includes the following essential duties and responsibilities other duties may also be assigned




 Provide frontline technical support to end-users via phone email and ticketing system
 Diagnose and troubleshoot hardware software and network-related issues
 Escalate complex problems to higher-level support teams when necessary
 Perform physical installation rack and stack cabling and networking of data center hardware
 Assist in the deployment of server storage and networking equipment
 Collaborate with the engineering team to ensure proper hardware deployment according to specifications
 Conduct quality checks and test system functionality post-installation
 Collaborate with Supermicro teams to gather client requirements and provide technical expertise during the post-sales process
 Coordinate with the engineering team to ensure seamless integration of hardware solutions
 Be willing to travel up to 50% of the time to customer sites and data centers




Qualifications




 5 years of experience in servicing complex X86 systems and parts
 Bachelor’s degree in Computer Science Computer Engineering and Electrical Engineering
 Or an Associate’s degree in Electrical/Electronics Engineering or equivalent discipline plus equivalent years of relevant experience preferably in the servicing of X86 systems and parts
 Minimum two years of experience from Customer Support background
 Demonstrated hardware system diagnostics skills as well as a good understanding of how BIOS drivers and application loads can cause system issues
 Ability to solve problems and make decisions as necessary
 Ability to work in a challenging dynamic and fast-paced environment Must be solution-oriented a team player with the ability to identify and escalate issues in a timely manner and be proactive in driving solutions
 Advanced Statistical Excel or database management
 Candidate must have an ability to participate in multiple cross-functional projects concurrently in a rapidly changing environment within established timelines and have a demonstrated ability to learn and embrace new and changing technologies
 Emphasize break/fix experience and on-site customer service experience
 Experience in Communicating with internal and external customers to explain total solutions Required
 Hands-on experience with Enterprise grade server hardware
 Must be punctual and detail-oriented
 Must possess an excellent ability to create plans and follow up on planned actions
 Strong written and verbal communication skills project management skills solid time management skills
 Excellent oral and written communication
 The candidate needs to have strong technical communication skills to lead investigations with engineers of multiple disciplines
 Work experience in a large enterprise or certification in Windows and Linux environment
 Must have valid license and reliable automobile




Salary Range




$75000 - $111000 




The salary offered will depend on several factors including your location level education training specific skills years of experience and comparison to other employees already in this role In addition to a comprehensive benefits package candidates may be eligible for other forms of compensation such as participation in bonus and equity award programs




EEO Statement




Supermicro is an Equal Opportunity Employer and embraces diversity in our employee population It is the policy of Supermicro to provide equal opportunity to all qualified applicants and employees without regard to race color religion sex sexual orientation gender identity national origin age disability protected veteran status or special disabled veteran marital status pregnancy genetic information or any other legally protected status"
3688182130,Software Test Engineer,Supermicro,San Jose,On-site,"76,000","1,40,000",108000,Yearly,Full-time,Entry level,Computer Hardware Manufacturing,"
Job Req ID 22718




About Supermicro




Supermicro® is a Top Tier provider of advanced server storage and networking solutions for Data Center Cloud Computing Enterprise IT Hadoop/ Big Data Hyperscale HPC and IoT/Embedded customers worldwide We are the #5 fastest growing company among the Silicon Valley Top 50 technology firms Our unprecedented global expansion has provided us with the opportunity to offer a large number of new positions to the technology community We seek talented passionate and committed engineers technologists and business leaders to join us




Job Summary




Supermicro is seeking a talented Software Test Engineer with great attention to detail and strong problem solving ability to join our software team You will be responsible for examining all aspects of the products/applications performing tests and implementing test automation If you are forward thinking engineer that can bring software quality improvement ideas and new strategies to lead the company forward we would love to talk to you




Essential Duties And Responsibilities




Includes the following essential duties and responsibilities other duties may also be assigned




 Implement software/firmware automation
 Perform software user interface functionality and stress testing
 Test multi node systems in VM environment
 Utilize analytical skills to validate and verify software/system issues
 Conduct unit testing for product development
 Perform BIOS IPMI SWITCH testing
 Enforce software Quality Control
 Participate in software customization
 Prepare evaluation reports on the software tests
 Work closely with Product Managers on OEM Projects
 Maintain the standards set by the company




Qualifications




 BS in Computer Science or related field of study
 1+ years of relevant work experience preferred open to new grad
 Black box testing experience is required and white box testing experience is a plus
 Familiarity with the SQA requirements methodology
 Ability to adapt quickly and excel in a fast-paced environment
 Creative thinker with a passion for quality
 JAVA Shell scripting Python experience a plus
 Excellent verbal and written communication skills in English




Salary Range




$76000 - $140000




The salary offered will depend on several factors including your location level education training specific skills years of experience and comparison to other employees already in this role In addition to a comprehensive benefits package candidates may be eligible for other forms of compensation such as participation in bonus and equity award programs




EEO Statement




Supermicro is an Equal Opportunity Employer and embraces diversity in our employee population It is the policy of Supermicro to provide equal opportunity to all qualified applicants and employees without regard to race color religion sex sexual orientation gender identity national origin age disability protected veteran status or special disabled veteran marital status pregnancy genetic information or any other legally protected status"
3681937913,System Engineer,Supermicro,San Jose,On-site,"76,000","1,38,000",107000,Yearly,Full-time,Entry level,Computer Hardware Manufacturing,"
Job Req ID 22167




About Supermicro




Supermicro® is a Top Tier provider of advanced server storage and networking solutions for Data Center Cloud Computing Enterprise IT Hadoop/ Big Data Hyperscale HPC and IoT/Embedded customers worldwide We are the #5 fastest growing company among the Silicon Valley Top 50 technology firms Our unprecedented global expansion has provided us with the opportunity to offer a large number of new positions to the technology community We seek talented passionate and committed engineers technologists and business leaders to join us




Job Summary




As a member of Rack Solution Team at Supermicro this candidate will be responsible for testing and validating hardware network storage and server components to create solutions meeting or exceeding the market requirements for both OEM and end-user customers to discover and resolve hardware and HW/SW issues collaboratively We hope you will be a fast-learner team player and with excellent communication skills




Essential Duties And Responsibilities




 Includes the following essential duties and responsibilities other duties may also be assigned 




 Perform system level and other cluster / rack level testing
 Conduct functionality testing compatibility testing performance testing stress and reliability testing
 Report hardware and software quality issues and work with other teams to solve the issues
 Document and analyze test date and test logs write test report
 Maintain and improve validation test plans and test cases
 Contribute in the development of test utilities and test script automation
 Support internal and external quality issues and drive to issue resolution




Qualifications




 BS / MS in EE CS CE or equivalent with 1 year of working experience in networking or server industry is strongly preferred
 Strong knowledge of computer architecture
 Familiar with Linux Windows and networking setup
 Programming experience with windows and Linux shell scripting Python scripting is a plus
 Strong sense of team work and good team player strong communication skills
 Familiar with various OS windows office tools
 Experience with Network / Hardware test is a plus
 Knowledge and experience of server performance benchmarks and tuning is a plus




Salary Range




$76000 - $138000




The salary offered will depend on several factors including your location level education training specific skills years of experience and comparison to other employees already in this role In addition to a comprehensive benefits package candidates may be eligible for other forms of compensation such as participation in bonus and equity award programs




EEO Statement




Supermicro is an Equal Opportunity Employer and embraces diversity in our employee population It is the policy of Supermicro to provide equal opportunity to all qualified applicants and employees without regard to race color religion sex sexual orientation gender identity national origin age disability protected veteran status or special disabled veteran marital status pregnancy genetic information or any other legally protected status"
