Job_ID,title,company,location,Mode,Min Salary,Max Salary,Avg Salary,Yr/Hr,Type,Level,Industry,Job Description
3694576831,Program Manager,Intuitive,Sunnyvale,On-site,"1,52,000","2,57,400",204700,Yearly,Full-time,Mid-Senior level,Medical Equipment Manufacturing,"
Company Description




At Intuitive we are united behind our mission we believe that minimally invasive care is life-enhancing care Through ingenuity and intelligent technology we expand the potential of physicians to heal without constraints




As a pioneer and market leader in robotic-assisted surgery we strive to foster an inclusive and diverse team committed to making a difference For more than 25 years we have worked with hospitals and care teams around the world to help solve some of healthcares hardest challenges and advance what is possible




Intuitive has been built by the efforts of great people from diverse backgrounds We believe great ideas can come from anywhere We strive to foster an inclusive culture built around diversity of thought and mutual respect We lead with inclusion and empower our team members to do their best work as their most authentic selves




Passionate people who want to make a difference drive our culture Our team members are grounded in integrity have a strong capacity to learn the energy to get things done and bring diverse real world experiences to help us think in new ways We actively invest in our team members to support their long-term growth so they can continue to advance our mission and achieve their highest potential




Join a team committed to taking big leaps forward for a global community of healthcare professionals and their patients Together lets advance the world of minimally invasive care




Job Description




Intuitive Surgical designs and manufactures highly complex surgical systems including cameras instruments and accessories for use in surgery We are looking for you to manage Robotic Assisted Surgical Devices projects associated with the development of these products




Development of Software/Mechanical/Electrical/Optical technology-based products and design transfer to the manufacturing and service organizations
Experienced with all phases of the system level software development lifecycle including idea generation concept development and testing design implementation validation and transfer




Roles And Responsibilities




This role is accountable for driving complex product development efforts from conception to manufacturing stability
Ensure Design Control processes are followed per relevant procedures FDA 21 CFR Part 820 and IEC62304 experience a plus
Driving a portfolio of product design projects
Ensure Design Control processes are followed per relevant procedures
Facilitate and ensure that complex high-value Business Unit projects are properly scoped resourced and communicated to minimize risk deliver on-time and on-budget
Organize and manage phase gate review meetings
Creating and maintaining project schedules
Develop and monitor project budgets
Provide clear communication to the organization on project status critical path as well as potential areas of risk
Work closely with Product Development Manufacturing Marketing Regulatory and Quality organizations to ensure input and representation in the development process
Work closely with NPI counterparts to ensure prototypes supplier and manufacturing activities are scheduled and tracked appropriately
Contributes to product prioritization steps by providing data and research from current and past projects
Provides feedback to team members regarding performance and requirements
Build informal and formal communication channels to deliver information that is accurate and up-to-date to all stakeholders
Utilize corporate approved tools and implement them to empower and unencumber team members as they work to complete projects
Organize and guide large numbers of distributed cross-functional resources successfully
Function as the primary point-of-contact for key stakeholders across the organization




Qualifications




Skill/Job Requirements




Minimum Bachelor’s Degree in an Engineering discipline required
12 + years of experience involved in the development and commercialization of medical devices as a project management/program manager
Previous experience working with software/electrical/mechanical product development is required
Ability to drive a large number of people on a variety of programs
Requires knowledge of engineering product strategy and business management
Experience in examining tradeoffs between product features customer needs/requirements produce-ability and cost
Desired project tools experience includes CA Technology - Resource Management tool JIRA Confluence




Nice To Have




Experience in design transfer experience is desired
Ability to communicate effectively with executive leadership on the project status
Willing to go the extra mile with an excellent work ethic self-directed and resourceful with the ability to deal with conflict and drive to solution
Proven ability to influence and work well at all levels of an organization and in a cross functional team environment
Ability to handle ambiguity effectively and oversee multiple projects at once
Demonstrated ability to synthesize data set actionable goals and drive metrics and execution
High attention to detail and proven ability to manage multiple priorities simultaneously must work well under pressure be flexible and meet deadlines
Energetic person with a drive for results who is accountable has a great attitude and is a team-player self-starter with high degree of initiative urgency and follow through
Certification in project management PMP desired




Additional Information




Due to the nature of our business and the role please note that Intuitive and/or your customers may require that you show current proof of vaccination against certain diseases including COVID-19 Details can vary by role




Intuitive is an Equal Employment Opportunity Employer We provide equal employment opportunities to all qualified applicants and employees and prohibit discrimination and harassment of any type without regard to race sex pregnancy sexual orientation gender identity national origin color age religion protected veteran or disability status genetic information or any other status protected under federal state or local applicable laws




We will consider for employment qualified applicants with arrest and conviction records in accordance with fair chance laws




Preference will be given to qualified candidates who do not reside or plan to reside in Alabama Arkansas Delaware Florida Indiana Iowa Louisiana Maryland Mississippi Missouri Oklahoma Pennsylvania South Carolina or Tennessee




We provide market-competitive compensation packages inclusive of base pay incentives benefits and equity It would not be typical for someone to be hired at the top end of range for the role as actual pay will be determined based on several factors including experience skills and qualifications The target salary ranges are listed




Base Salary Range Region 1$178800 - $257400




Base Salary Range Region 2 $152000 - $218800




Shift Day




Travel 10% of the time




Workplace Type Set Schedule - This job will be onsite weekly the percentage of onsite work will be defined by the leader"
3555142738,Selling Associate-Sunvalley VS,Victoria’s Secret & Co.,Concord,Hybrid,16,20.25,18,Hourly,Part-time,Entry level,Retail,"
Description




The Selling Associate drives sales growth by flexing into multiple areas of the store including selling cashiering processing replenishing setting floorsets and/or cleaning Serving the customer is always top priority regardless of work area The Selling Associate will likely spend the majority of their time in two of these skill areas and will have the opportunity to learn other skills as needed




Key Responsibilities




When assigned to the sales floor




Drives store sales and growth by personally selling to customers
Proactively engages with customers reads cues and responds effectively
Provides customers with the perfect bra fit by asking effective questions
Converting returns offers and other promotions into larger sales




When assigned to the cash wrap




Delivers a friendly and efficient cash wrap experience processing customer transactions accurately and efficiently at the Point of Sale
Reinforces customer buying decisions at checkout and encourages purchase of additional items
Recovers cash wrap selling zone and “go-backs”
Builds customer loyalty by opening Victoria’s Secret Angel Cards US only and through customer email and phone capture
When assigned to processing and replenishment
Processes merchandise to be floor ready and maintains back room and under stock to brand standards
Replenishes merchandise to brand standards to ensure product is placed on the sales floor and available for purchase
Assists with other projects as needed including markdowns re-tickets and the mark out of stock process
When assigned to floorset activity
Executes floorset proficiently
Understands and adheres to brand standards
Assists with maintenance of back room and under stock including merchandise and non-merchandise to brand standards to enable efficient replenishment




All associate roles at Victoria’s Secret are responsible for




Driving top line store sales results and growing the business through action and productivity
Maintaining a focus on bras as the premier product differentiator to build loyalty and support our Best at Bras culture
Creating customer awareness of programs available to them ie Victoria’s Secret Angel Card US only phone and email capture to build customer loyalty when applicable
Setting personal goals and tracking individual and team performance to the goals
Preparing for each shift by maintaining awareness of all sales promotions and applicable ringing procedures
Taking initiative to recover and replenish merchandise so it is available to sell
Understanding and adhering to visual merchandising brand standards
Assisting in housekeeping of sales floor and communicating maintenance issues
Keeping an awareness of and building personal capability in loss prevention
Reinforcing store strategy to reduce shrink
Supporting all activities related to providing a safe working environment
Understanding and demonstrating Company values




Click here for benefit details related to this position




Minimum Salary $1600




Maximum Salary $2025




VS&Co provides a range of compensation for this role as shown Your actual salary will be determined by a number of factors including your specific skills and experience geographic region or other relevant factors




Qualifications




Exhibits an authentic desire to exceed the customer’s expectations
Proven ability to meet or exceed goals preferred
Demonstrates a sense of urgency
Has a healthy competitive spirit while maintaining a team focus
Is resilient and bounces back quickly from setbacks
Pursues opportunities to take on more responsibility
Seeks out coaching from leaders and peers to improve productivity leads own learning
Schedule flexibility that includes evenings weekends holidays and non-business hours




An equal opportunity employer we do not discriminate in hiring or terms and conditions of employment because of an individual’s race color religion gender gender identity national origin citizenship age disability sexual orientation marital status or any other protected category recognized by state federal or local laws We only hire individuals authorized for employment in the United States"
3690963821,"Strategic Finance, Go-to-Market",Notion,San Francisco,On-site,"1,60,000","1,90,000",175000,Yearly,Full-time,Mid-Senior level,Software Development,"
About Us

Were on a mission to make it possible for every person team and company to be able to tailor their software to solve any problem and take on any challenge Computers may be our most powerful tools but most of us cant build or modify the software we use on them every day At Notion we want to change this with focus design and craft

Weve been working on this together since 2016 and have customers like Pixar Mitsubishi Figma Plaid Match Group and thousands more on this journey with us Today were growing fast and excited for new teammates to join us who are the best at what they do Were passionate about building a company as diverse and creative as the millions of people Notion reaches worldwide

Notion is an in person company and currently requires its employees to come to the office for two Anchor Days Mondays & Thursdays and requests that employees spend the majority of their week in the office including a third day

About The Role

The Strategic Finance team is a newly established function responsible for maximizing Notion’s long term value by evaluating and facilitating strategic decisions allocation and deployment of the Company’s resources This team is responsible for leading the annual and quarterly planning process performing financial analyses and partnering with teams across Notion to track performance at the company and strategic level

The GTM Strategic Finance team is responsible for driving the forecasting planning and reporting of all key metrics related to Notion’s GTM business As an early member of the team you will partner closely with Sales Marketing and RevOps to build the financial infrastructure key to understanding and accelerating Notion’s GTM business This high impact role requires someone who is highly analytical strategic and loves data & numbers

What Youll Achieve


Early member of the Strategic Finance team with a focus on Go-To-Market forecasting attribution and insights
Build and own source-of-truth frameworks and models for all Sales Assist KPIs including ARR/iARR churn/contraction and sales productivity & unit economics
Provide broad financial support including preparation of financial plans internal management reporting dashboards and ad-hoc analyses for Finance and Go-To-Market leadership
Work closely with cross-functional leaders to report manage and control business performance identifying areas of growth potential and unexpected variances
Collaborate with Strategic Finance and Business Operations on annual planning process quarterly reforecasts and long-range strategic plans
Assist with presentation communicating Notion’s strategy and performance for the Company’s Board of Directors and investors
Support key strategic initiatives such as M&A strategic partnerships and capital markets activities


Skills Youll Need To Bring


5+ years of Finance experience including a strong foundation at high-growth SaaS technology companies preferably with previous Investment banking and/or private equity experience
Expert-level financial modeling skills with strong attention to detail and high standards for quality
Proficiency in SQL and experience working with Data team to measure performance access relevant data and build dashboards
Analytical mindset to draw insights from data deep-dive into operational drivers and influence business decisions
Strong verbal and written communication skills with the ability to work effectively with non-financial audiences
Ability operating independently and manage ambiguity in a fast-moving environment You’re a self-starter who can manage relationships deliverables and expectations with your business partners/key stakeholders


Nice To Haves


Strong understanding of both product-led growth and sales-led growth B2B SaaS businesses metrics and customer lifecycle
Experience in Sales Strategy Sales Operations and/or Sales FP&A
Proficiency in Python and/or R


We hire talented and passionate people from a variety of backgrounds because we want our global employee base to represent the wide diversity of our customers If you’re excited about a role but your past experience doesn’t align perfectly with every bullet point listed in the job description we still encourage you to apply If you’re a builder at heart share our company values and enthusiastic about making software toolmaking ubiquitous we want to hear from you

Notion is proud to be an equal opportunity employer We do not discriminate in hiring or any employment decision based on race color religion national origin age sex including pregnancy childbirth or related medical conditions marital status ancestry physical or mental disability genetic information veteran status gender identity or expression sexual orientation or other applicable legally protected characteristic Notion considers qualified applicants with criminal histories consistent with applicable federal state and local law Notion is also committed to providing reasonable accommodations for qualified individuals with disabilities and disabled veterans in our job application procedures If you need assistance or an accommodation due to a disability please let your recruiter know

Notion is committed to providing highly competitive cash compensation equity and benefits The compensation offered for this role will be based on multiple factors such as location the role’s scope and complexity and the candidate’s experience and expertise and may vary from the range provided below For roles based in San Francisco the estimated base salary range for this role is $160000 - $190000 per year

"
3697313153,CMC Project Manager,REVOLUTION Medicines,San Francisco Bay Area,Hybrid,"1,60,000","2,00,000",180000,Yearly,Full-time,Mid-Senior level,Biotechnology,"

Revolution Medicines is a clinical-stage precision oncology company focused on developing novel targeted therapies to inhibit frontier targets in RAS-addicted cancers The company’s R&D pipeline comprises RASON Inhibitors designed to suppress diverse oncogenic variants of RAS proteins and RAS Companion Inhibitors for use in combination treatment strategies As a new member of the Revolution Medicines team you will join other outstanding scientists in a tireless commitment to patients with cancers harboring mutations in the RAS signaling pathway




Playing a critical role as a Project Manager within Pharmaceutical Development and Manufacturing PDM organization the position will be responsible for managing cross-functional project activities timelines and enabling project leads and/or functional leads in driving the development and execution of the development strategies and plans







The Opportunity







Provide project management support to PDM teams for projects ranging from Pre-IND through different phases of clinical development and commercialization
Enable PDM leads and/or functional leads in implementing comprehensive PDM strategies and development plans and driving the PDM timelines to meet projects’ needs
Develop maintain and track PDM timelines and other relevant documents
Collaborate with team members in PDM QA and Regulatory Affairs to execute the PDM projects according to established PDM development plans
Coordinate with the Regulatory Affairs team to track coordinate and communicate PDM regulatory filing timelines as needed
Collaborate with PDM leads to plan and facilitate regular and effective PDMC project meetings with structured agendas and accurate meeting minutes follow up on action items
Proactively identify potential key issues and communicate with key stakeholders and management in a timely manner
Provide project management support to enable oversight of the development activities outsourced to CDMOs as needed
Support and facilitate the PDM portfolio review process to support the growing pipeline







Required Experience Skills and Education







BS or MS or a PhD degree in Pharmaceutics Chemistry Chemical Engineering or a closely related field is desirable
10+ years of experience in the pharmaceutical/biotech industry with PDM drug development experience small molecule drug development experience is preferred
Strong PDM project management experience in early and/or late phase development with a good understanding of the drug development cycle regulatory filings experience a plus
Good understanding and experience of PDM considerations with respect to GMP quality systems ICH guidelines FDA and associated regulatory requirements
Demonstrated strong cross-functional project management skills
Ability to translate high-level strategies into actionable items
Effective team player with an entrepreneurial spirit and leadership skills
Ability to communicate effectively with team members with a diverse range of backgrounds
Excellent written and verbal communication skills and interpersonal skills
Innovative team player with high energy for our dynamic company environment




Revolution Medicines currently requires that all personnel and visitors to its offices be fully vaccinated against COVID-19 This role will require that the employee meet with company employees and work from the company’s offices Given that these essential functions of the role must be performed on-site this position requires full COVID-19 vaccination subject to applicable law

Revolution Medicines is an equal opportunity employer and prohibits unlawful discrimination based on race color religion gender sexual orientation gender identity/expression national origin/ancestry age disability marital status medical condition and veteran status"
3710672186,Founding Security Engineer,Code Red Partners,San Francisco Bay Area,Hybrid,"1,60,000","2,00,000",180000,Yearly,Full-time,Mid-Senior level,Staffing and Recruiting,"

Introduction




Code Red is currently engaged with a company focused on building a real-time AI powered platform specializing in threat detection for the web and blockchain stack 




Changing the game to eliminate audits and have security powered solely by data They are looking for a Founding Security Engineer to build out the security foundation and create the roadmap and vision to improve the security platform as a whole 




 

What You’ll Do







Conduct incident response and create mitigation plans
Work closely with stakeholders and contribute to the technical direction of the company
Automate processes to help build out security operations
Help grow out the team as an engineering leader
Provide security guidance and build out tooling both in-house and open source







Does this sound like you?







3+ years of experience in incident response detection engineering security research or other related security pillars
Fundamental understanding and core experience in Blockchain technology
Startup mentality







Cant wait to hear more about this position?

Click Apply below or reach out to Rosie Geroux rosie@coderedpartnerscom and they will share more information and details about the role

Code Red Partners are extremely committed to working with equal opportunity employers helping build a diverse and inclusive workforce within Cyber Security We put the people we work with at the heart of everything we do and dedicate all we do to playing a part in developing an industry that represents a variety of backgrounds perspectives and skills"
