Job_ID,title,company,location,Mode,Min Salary,Max Salary,Avg Salary,Yr/Hr,Type,Level,Industry,Job Description
3627104849,"Sr. Software Engineer, ML Acceleration and Performance",Rivian,Palo Alto,On-site,"1,84,000","2,11,000",197500,Yearly,Full-time,Mid-Senior level,Motor Vehicle Manufacturing,"




As a company we constantly challenge what’s possible never simply accepting what has always been done We reframe old problems seek new solutions and operate comfortably in areas that are unknown Our backgrounds are diverse but our team shares a love of the outdoors and a desire to protect it for future generations

Role Summary

As a Sr Software Engineer ML Acceleration and Performance  you will be a member of the Perception team at Rivian which develops advanced machine learning algorithms that directly impact safety critical self-driving features of our category defining vehicles

Responsibilities

 Develop optimize and deploy ultra-low latency Deep learning/ Machine Learning algorithms for Rivian ADAS and Autonomy use cases 
 Research state of the art model compression and efficient model design techniques and enable the team to leverage these across a wide range of customer facing features 
 Collaborate with the low-level software and hardware architecture teams to characterize the in-house ML models on our embedded platforms and optimize the models subject to the on device compute and memory constrains 

Qualifications
 MS or PhD in Computer Science Electrical Mechanical Aerospace Engineering or a related field 
Good understanding of the fundamentals of deep learning heterogenous computing ML accelerators and compilers with 3 + years of industrial experience 
Good team player with great communication skills to drive cross functional efforts in a fast-paced development environment
Research and development experience in the following areas
model compression and neural architecture search techniques
knowledge distillation pruning quantization and quantization aware training
optimizing and deploying inference on various embedded processors
Experience defining compute architecture for efficient Deep learning inferencing
Capability to understand hardware spec documents and performance profiling tools
Strong Python programming background and in-depth knowledge of at least one framework amongst PyTorch TensorFlow or MXNet
Experience implementing inference logic from first principles using low level subroutines like BLAS CUDA Kernels or C++ natively
Familiarity with ONNX runtimes and DL compilers like XLA or Glow

Pay Disclosure

Salary Range for California Based Applicants [$18400000 - $21100000] actual compensation will be determined based on experience location and other factors permitted by law

Benefits Summary Rivian provides robust medical/Rx dental and vision insurance packages for full-time employees their spouse or domestic partner and children up to age 26 Coverage is effective on the first day of employment and Rivian covers most of the premiums

Equal Opportunity

Rivian is an equal opportunity employer and complies with all applicable federal state and local fair employment practices laws All qualified applicants will receive consideration for employment without regard to race color religion national origin ancestry sex sexual orientation gender gender expression gender identity genetic information or characteristics physical or mental disability marital/domestic partner status age military/veteran status medical condition or any other characteristic protected by law

Rivian is committed to ensuring that our hiring process is accessible for persons with disabilities If you have a disability or limitation such as those covered by the Americans with Disabilities Act that requires accommodations to assist you in the search and application process please email us at candidateaccommodations@riviancom 

Candidate Data Privacy

Rivian may collect use and disclose your personal information or personal data within the meaning of the applicable data protection laws when you apply for employment and/or participate in our recruitment processes “Candidate Personal Data” This data includes contact demographic communications educational professional employment social media/website network/device recruiting system usage/interaction security and preference information Rivian may use your Candidate Personal Data for the purposes of i tracking interactions with our recruiting system ii carrying out analyzing and improving our application and recruitment process including assessing you and your application and conducting employment background and reference checks iii establishing an employment relationship or entering into an employment contract with you iv complying with our legal regulatory and corporate governance obligations v recordkeeping vi ensuring network and information security and preventing fraud and vii as otherwise required or permitted by applicable law

Rivian may share your Candidate Personal Data with i internal personnel who have a need to know such information in order to perform their duties including individuals on our People Team Finance Legal and the teams with the positions for which you are applying ii Rivian affiliates and iii Rivian’s service providers including providers of background checks staffing services and cloud services

Rivian may transfer or store internationally your Candidate Personal Data including to or in the United States Canada the United Kingdom and the European Union and in the cloud and this data may be subject to the laws and accessible to the courts law enforcement and national security authorities of such jurisdictions

Please note that we are currently not accepting applications from third party application services"
3627108427,"Staff Software Engineer, Vehicle Applications (Infotainment)",Rivian,Palo Alto,On-site,"1,84,000","2,11,000",197500,Yearly,Full-time,Mid-Senior level,Motor Vehicle Manufacturing,"




As a company we constantly challenge what’s possible never simply accepting what has always been done We reframe old problems seek new solutions and operate comfortably in areas that are unknown Our backgrounds are diverse but our team shares a love of the outdoors and a desire to protect it for future generations

Role Summary

The Infotainment team is chartered to develop software applications and SDKs for Rivian products and composed of developers of all backgrounds with experience in IOS Android SDKs IoT Bluetooth Security and we are growing! Come help build the Rivian In-Vehicle user experience encompassing vehicle controls vehicle modes charging among many other live customer facing features

Responsibilities

Design and develop Rivian infotainment applications on Android Automotive OS
Collaborate with cross-functional teams including vehicle software product and UI/UX design teams to define application features
Identify potential problems and resolve application bottlenecks for performance optimizations
Triage debug and fix application issues before final release
Perform code reviews and practice continuous integration and development
Write test code to test for quality robustness and functional correctness including edge cases
Design and implement subsequent application updates and releases
Grow your skills with continual learning workshops conferences and talks

Qualifications

Bachelor’s degree in Computer Science or Software Engineering 
Knowledge of Android design principles and application interface guidelines
Excellent coding and proofreading skills in Kotlin and Java
Ability to manage your workload with minimal supervision
Proficient in code versioning tools including Git gitlab and others
Experience with continuous integration tools such as Jenkins
Excellent inter-personal skills with the ability to collaboratively work with and influence cross-functional teams
Top-notch teamwork and communication skills
Knowledge of Android’s performance and testing framework
Experience in system application development is a plus
Experience in infotainment application development in AAOS is a plus

Pay Disclosure

Salary Range for California Based Applicants $184000 - $211000 actual compensation will be determined based on experience location and other factors permitted by law

Benefits Summary Rivian provides robust medical/Rx dental and vision insurance packages for full-time employees their spouse or domestic partner and children up to age 26 Coverage is effective on the first day of employment and Rivian covers most of the premiums

Equal Opportunity

Rivian is an equal opportunity employer and complies with all applicable federal state and local fair employment practices laws All qualified applicants will receive consideration for employment without regard to race color religion national origin ancestry sex sexual orientation gender gender expression gender identity genetic information or characteristics physical or mental disability marital/domestic partner status age military/veteran status medical condition or any other characteristic protected by law

Rivian is committed to ensuring that our hiring process is accessible for persons with disabilities If you have a disability or limitation such as those covered by the Americans with Disabilities Act that requires accommodations to assist you in the search and application process please email us at candidateaccommodations@riviancom 

Candidate Data Privacy

Rivian may collect use and disclose your personal information or personal data within the meaning of the applicable data protection laws when you apply for employment and/or participate in our recruitment processes “Candidate Personal Data” This data includes contact demographic communications educational professional employment social media/website network/device recruiting system usage/interaction security and preference information Rivian may use your Candidate Personal Data for the purposes of i tracking interactions with our recruiting system ii carrying out analyzing and improving our application and recruitment process including assessing you and your application and conducting employment background and reference checks iii establishing an employment relationship or entering into an employment contract with you iv complying with our legal regulatory and corporate governance obligations v recordkeeping vi ensuring network and information security and preventing fraud and vii as otherwise required or permitted by applicable law

Rivian may share your Candidate Personal Data with i internal personnel who have a need to know such information in order to perform their duties including individuals on our People Team Finance Legal and the teams with the positions for which you are applying ii Rivian affiliates and iii Rivian’s service providers including providers of background checks staffing services and cloud services

Rivian may transfer or store internationally your Candidate Personal Data including to or in the United States Canada the United Kingdom and the European Union and in the cloud and this data may be subject to the laws and accessible to the courts law enforcement and national security authorities of such jurisdictions

Please note that we are currently not accepting applications from third party application services"
3627104824,"Staff Systems Integration Engineer, Autonomy",Rivian,Palo Alto,On-site,"1,84,000","2,11,000",197500,Yearly,Full-time,Mid-Senior level,Motor Vehicle Manufacturing,"




As a company we constantly challenge what’s possible never simply accepting what has always been done We reframe old problems seek new solutions and operate comfortably in areas that are unknown Our backgrounds are diverse but our team shares a love of the outdoors and a desire to protect it for future generations

Role Summary

As part of the Autonomy Systems Integration team you will be fundamental in the successful development and deployment of Rivian’s suite of ADAS/Autonomy features You will be part of the Palo Alto based System Integration team which works cross functionally with Rivian SW development teams based locally and throughout Rivian locations around the country This role is expected to be onsite with occasional travel required in order to meet development and testing needs

Responsibilities

 Develop and execute vehicle integration plans related to ADAS & Self-Driving related sub-system integration while keeping track of overall program milestones and delivery objectives  
 Support efforts related to integration including overall vehicle build commissioning/bring-up of various sensor & actuator systems and developmental testing on prototype and production vehicle platforms 
 Identify  document and highlight cross-functional gaps and dependencies - proactively work towards creative solutions to resolve integration issues and ensure vehicle functionality 
 Deep-dive into vehicle log data and source code if required to root-cause system-level issues and facilitate rapid issue resolution in collaboration with domain experts 
 Support systems engineering activities including interface definition development and functional testing in coordination with various vehicle-level systems 
 Develop and execute test plans and automation for functional verification of autonomy SW on various test vehicle platforms - prior to hand-off to test & validation teams 
 Perform analysis of vehicle data to develop insightful KPIs to verify the performance requirements and safety of autonomy features 

Qualifications

 BS+ in Electrical Engineering Computer Science Mechanical Engineering or a related field with 5+ years of relevant industry experience 
 Strong understanding of dependencies between various electrical & mechanical systems 
 Experience with autonomy / systems engineering / automotive network architecture / vehicle integration 
 Strong working knowledge of automotive electrical systems and communication protocols CAN Flexray  Ethernet and relevant debug tools 
 Hands-on experience debugging complex systems that involve multiple ECUs with interfaces to various vehicle sub-systems 
 Python and/or SQL experience for data analysis KPI definition and validation and system performance evaluation 
 Strong understanding of automotive hardware and software development concepts including continuous integration continuous deployment CI/CD software development models 
 Ability to work in a fast-paced development environment -proactively collaborate cross-functionally with other teams to solve vehicle-level integration problems 
 Strong understanding of vehicle safety concepts and testing-related safety procedures 
 Flexibility to travel domestically/internationally  up to 50 %  to support various vehicle-level integration and test activities 
 Clean driving record with professional experience driving prototype test-vehicles in test-tracks 

Pay Disclosure

Salary Range for California Based Applicants [$18400000 - $21100000] actual compensation will be determined based on experience location and other factors permitted by law

Benefits Summary Rivian provides robust medical/Rx dental and vision insurance packages for full-time employees their spouse or domestic partner and children up to age 26 Coverage is effective on the first day of employment and Rivian covers most of the premiums

Equal Opportunity

Rivian is an equal opportunity employer and complies with all applicable federal state and local fair employment practices laws All qualified applicants will receive consideration for employment without regard to race color religion national origin ancestry sex sexual orientation gender gender expression gender identity genetic information or characteristics physical or mental disability marital/domestic partner status age military/veteran status medical condition or any other characteristic protected by law

Rivian is committed to ensuring that our hiring process is accessible for persons with disabilities If you have a disability or limitation such as those covered by the Americans with Disabilities Act that requires accommodations to assist you in the search and application process please email us at candidateaccommodations@riviancom 

Candidate Data Privacy

Rivian may collect use and disclose your personal information or personal data within the meaning of the applicable data protection laws when you apply for employment and/or participate in our recruitment processes “Candidate Personal Data” This data includes contact demographic communications educational professional employment social media/website network/device recruiting system usage/interaction security and preference information Rivian may use your Candidate Personal Data for the purposes of i tracking interactions with our recruiting system ii carrying out analyzing and improving our application and recruitment process including assessing you and your application and conducting employment background and reference checks iii establishing an employment relationship or entering into an employment contract with you iv complying with our legal regulatory and corporate governance obligations v recordkeeping vi ensuring network and information security and preventing fraud and vii as otherwise required or permitted by applicable law

Rivian may share your Candidate Personal Data with i internal personnel who have a need to know such information in order to perform their duties including individuals on our People Team Finance Legal and the teams with the positions for which you are applying ii Rivian affiliates and iii Rivian’s service providers including providers of background checks staffing services and cloud services

Rivian may transfer or store internationally your Candidate Personal Data including to or in the United States Canada the United Kingdom and the European Union and in the cloud and this data may be subject to the laws and accessible to the courts law enforcement and national security authorities of such jurisdictions

Please note that we are currently not accepting applications from third party application services"
3627110178,"Staff Software Engineer, Simulation Infrastructure",Rivian,Palo Alto,On-site,"1,84,000","2,11,000",197500,Yearly,Full-time,Mid-Senior level,Motor Vehicle Manufacturing,"




As a company we constantly challenge what’s possible never simply accepting what has always been done We reframe old problems seek new solutions and operate comfortably in areas that are unknown Our backgrounds are diverse but our team shares a love of the outdoors and a desire to protect it for future generations

Role Summary

Rivian’s Simulation team is building scalable systems to understand how our autonomy stack performs against a massive set of real-world and synthetic scenarios Our goal is to have a very clear set of acceptance criteria so that Rivian’s Autonomy team can confidently deploy leading-edge driver-assist features to our growing fleet

Responsibilities

 Design develop and deploy underlying simulation infrastructure to enable execution of autonomy features at scale 
 Partner with Autonomy and Middleware teams to develop use-case specific applications to verify performance Examples include AEB Automatic Emergency Braking ACC Adaptative Cruise Control or HWA Highway Assist 
 Co-design performance evaluation strategies with Systems Safety and Autonomy teams 
 Connect simulation outputs with visualization and analytics tools 
 Enable advanced Simulation capabilities such as ML-training intelligent agent decision-making and representative vehicle dynamics modeling 

Qualifications

 Bachelor’s degree in Computer Science Software Engineering Applied Mathematics Electrical Engineering Computer Engineering or related field Master’s degree preferred 
 8+ years’ experience of developing production-grade software from requirements gathering through to implementation and maintenance 
 Expertise in modern C and/or C++ as well as python programming skills 
 Strong background in developing applications for Linux operating systems 
 Familiarity with robotics systems such as perception planning localization prediction or controls 

Pay Disclosure

Salary Range for California Based Applicants [$18400000 - $21100000] actual compensation will be determined based on experience location and other factors permitted by law

Benefits Summary Rivian provides robust medical/Rx dental and vision insurance packages for full-time employees their spouse or domestic partner and children up to age 26 Coverage is effective on the first day of employment and Rivian covers most of the premiums

Equal Opportunity

Rivian is an equal opportunity employer and complies with all applicable federal state and local fair employment practices laws All qualified applicants will receive consideration for employment without regard to race color religion national origin ancestry sex sexual orientation gender gender expression gender identity genetic information or characteristics physical or mental disability marital/domestic partner status age military/veteran status medical condition or any other characteristic protected by law

Rivian is committed to ensuring that our hiring process is accessible for persons with disabilities If you have a disability or limitation such as those covered by the Americans with Disabilities Act that requires accommodations to assist you in the search and application process please email us at candidateaccommodations@riviancom 

Candidate Data Privacy

Rivian may collect use and disclose your personal information or personal data within the meaning of the applicable data protection laws when you apply for employment and/or participate in our recruitment processes “Candidate Personal Data” This data includes contact demographic communications educational professional employment social media/website network/device recruiting system usage/interaction security and preference information Rivian may use your Candidate Personal Data for the purposes of i tracking interactions with our recruiting system ii carrying out analyzing and improving our application and recruitment process including assessing you and your application and conducting employment background and reference checks iii establishing an employment relationship or entering into an employment contract with you iv complying with our legal regulatory and corporate governance obligations v recordkeeping vi ensuring network and information security and preventing fraud and vii as otherwise required or permitted by applicable law

Rivian may share your Candidate Personal Data with i internal personnel who have a need to know such information in order to perform their duties including individuals on our People Team Finance Legal and the teams with the positions for which you are applying ii Rivian affiliates and iii Rivian’s service providers including providers of background checks staffing services and cloud services

Rivian may transfer or store internationally your Candidate Personal Data including to or in the United States Canada the United Kingdom and the European Union and in the cloud and this data may be subject to the laws and accessible to the courts law enforcement and national security authorities of such jurisdictions

Please note that we are currently not accepting applications from third party application services"
